"Noticia","Tipo","Pagina"
"Desde el próximo lunes 29 de junio del 2020, la Corte Constitucional (CC) reanudará todos los plazos y términos previstos en la Ley Orgánica de Garantías y en el Reglamento de Sustanciación de Procesos. Así lo informó esa entidad hoy, viernes 26 de junio del 2019.",0,"El Comercio"
"El ministerio de Producción, Comercio Exterior, Inversiones y Pesca (MPCEIP) presentó este viernes, 26 de junio del 2020, el Fondo Emprende: Ecuador Productivo.",0,"El Comercio"
"Ecuador registra este viernes 26 de junio del 2020 un total de 53 856 casos confirmados de covid-19 a escala nacional. 700 nuevos contagios en 24 horas, según el informe 120 del Ministerio de Salud Pública, con corte a las 08:00.",0,"El Comercio"
"Una vez que Jaime Nebot confirmó que no será candidato en las elecciones presidenciales del 2021, en el Partido Social Cristiano (PSC) se alistan las posibles candidaturas a esa dignidad. Al menos tres nombres se barajan para la primera magistratura.",0,"El Comercio"
"Las parroquias de Chillogallo, Guamaní y La Magdalena, en el sur de Quito, Belisario Quevedo, en el centro-norte, y el Centro Histórico concentran la mayor cantidad de casos de covid-19 desde que se inició la cuarentena en la urbe.",0,"El Comercio"
"El presidente Lenín Moreno firmó el miércoles 24 de junio del 2020 los decretos ejecutivos con los que dio por terminadas las funciones de los embajadores de Ecuador en Costa Rica, Francia, Hungría, Indonesia, Irán, Nicaragua, Rusia y Sudáfrica.",0,"El Comercio"
"El Gobierno del Ecuador dijo el jueves 25 de junio del 2020 que implementa una plataforma tecnológica para medir el distanciamiento físico entre los ciudadanos en espacios públicos, en un intento por mitigar el contagio de coronavirus mientras reactiva progresivamente su actividad económica.",0,"El Comercio"
"Luego que el presidente de la República, Lenín Moreno, dispuso a la ministra de Turismo Rosi Prado de Holguín para que active la campaña de turismo interno, el MinTur, a través de la Subsecretaría de Promoción, da mayor realce a la campaña Te Prometo Ecuador. La iniciativa busca que los viajeros decidan visitar los fantásticos lugares que ofrecen las cuatro regiones del país una vez que se controle la emergencia sanitaria por el covid-19.",0,"El Comercio"
"El hospital del Instituto Ecuatoriano de Seguridad Social (IESS) en la capital de Tungurahua y el Hospital Regional Ambato recibieron 14 000 mascarillas, dentro de una iniciativa para apoyar a personal médico y de enfermería en nueve provincias de Ecuador por el covid-19.",0,"El Comercio"
"Ecuador acoge a unos 400 000 migrantes venezolanos y el 40% se concentra en la capital, Quito. Ese es uno de los datos que arroja el informe Retos y Oportunidades de la Migración Venezolana en Ecuador, presentado este jueves 25 de junio del 2020.",0,"El Comercio"
"Las cámaras de seguridad del servicio integrado ECU 911 serán utilizadas en Ecuador para vigilar el distanciamiento físico entre los ciudadanos. Esta es una medida que busca mitigar el contagio de covid-19 en el país.",0,"El Comercio"
"Con la ratificación del presidente Lenín Moreno del Acuerdo Comercial de Asociación Económica Inclusiva con la Asociación Europea de Libre Comercio (EFTA, por sus siglas en inglés) se cumple un paso más para que pueda entrar en vigencia este acuerdo.",0,"El Comercio"
"Este 25 de junio del 2020 se publicó la resolución del Consejo de Educación Superior (CES) que permite a las Instituciones de Educación Superior (IES) cambiar total o parcialmente la modalidad de estudios a un formato ‘en línea’ en las carreras y/o programas de su oferta vigente.",0,"El Comercio"
"Faltan pocos días, en el caso de algunos planteles particulares, unas semanas, para que termine el año lectivo 2019-2020, en la Sierra y Amazonía. Y los padres de familia se preguntan ¿qué ocurrirá el siguiente ciclo? ¿Los chicos deberán acudir a clases presenciales pese a que aún no haya desaparecido la amenaza del covid-19? La ministra de Educación, Monserrat Creamer, respondió a las inquietudes, el miércoles 24 de junio del 2020.",0,"El Comercio"
"La plataforma Distancia2 fue estrenada la mañana de este jueves 25 de junio del 2020 en las instalaciones del ECU 911 ubicadas en el parque Itchimbía, en el centro de Quito. El objetivo es aprovechar la infraestructura de videovigilancia disponible en el país para reducir el riesgo de contagio del covid-19 durante la emergencia sanitaria.",0,"El Comercio"
"El expresidente de la República, Rafael Correa, dijo que le gustaría ser candidato a vicepresidente en las elecciones del 2021. El exmandatario, sobre quien pesan dos órdenes de prisión preventiva, dio esta declaración en una videoconferencia desde Bélgica, en donde reside actualmente, este jueves 25 de junio del 2020.",0,"El Comercio"
"Un total de 822 casos nuevos de covid-19 se registran en Ecuador este 25 de junio del 2020 lo que aumenta la cifra total a 53 156. Así lo reporta el informe de la pandemia en el país presentado por el Ministerio de Salud Pública con corte a las 08:00.",0,"El Comercio"
"Al término del primer debate del Proyecto de Código Orgánico para la Protección Integral de Niñas, Niños y Adolescentes, la mayoría de asambleístas que intervinieron durante el pleno de la Asamblea se mostró a favor de que este proyecto tenga una amplia socialización.",0,"El Comercio"
"La Corte Constitucional (CC) resolvió suspender la vigencia del Acuerdo Ministerial 179 emitido por la Cartera de Defensa, relacionado al uso progresivo, racional y diferenciado de la fuerza, por parte de las Fuerzas Armadas.",0,"El Comercio"
"Los jefes de Estado y de Gobierno de 11 países, entre ellos el de Ecuador, suscribieron este 24 de junio del 2020 una iniciativa para enfrentar el impacto económico del covid-19, que apela a un mayor apoyo financiero y técnico.",0,"El Comercio"
"Un pedido con 28 puntos plantea el Comité de Crisis del Turismo de Ibarra (Imbabura) para la reactivación del sector.",0,"El Comercio"
"Una nueva especie de mariposa hallada en los bosques montanos de los Andes del Ecuador fue descrita en un artículo científico publicado en la revista Tropical Lepidoptera Research.",0,"El Comercio"
"Sevilla de Oro, ubicado en la zona nororiental de Azuay, en el límite con Morona Santiago, pasará a semáforo verde desde el viernes 26 de junio de 2020. Esta decisión fue adoptada la tarde del martes 23 de junio, por parte del COE cantonal.",0,"El Comercio"
"El cantón Salitre, en Guayas, pasó a semáforo verde este miércoles 24 de junio de 2020. Este es el cuatro cantón del país y el segundo de la provincia -después de Daule- en esta fase del semáforo sanitario, según el mapa que maneja el Servicio Nacional de Gestión de Riesgos y Emergencia.",0,"El Comercio"
"El Ministerio del Ambiente envió ayer, martes 23 de junio del 2020, un comunicado a los guardaparques notificados el viernes 19 de junio, en el que se explica que no serán desvinculados de esta cartera del Estado.",0,"El Comercio"
"Teresa Casa es una artesana ibarreña. Forma parte de la tercera generación de una de las decenas de familias de Zuleta, que, por décadas, se ha dedicado al bordado a mano.",0,"El Comercio"
"Un aventurero argentino que quedó varado hace tres meses en Perú por la pandemia del coronavirus quiere ser repatriado, pero con sus mascotas: dos perros que adoptó a su paso por Colombia y Ecuador.",0,"El Comercio"
"La diseñadora textil Verónica Buitrón lanzó, a mediados de mayo, y de forma digital el ‘Manual de tintes naturales de la sierra ecuatoriana’. Esta es una guía para extraer tintes de plantas silvestres e ingredientes de cocina para teñir ropa, tela o hilos de fibras naturales.",0,"El Comercio"
"Colombia anunció este martes 23 de junio de 2020 un acuerdo con Ecuador para flexibilizar la circulación de vehículos por la frontera común, suspendida por la pandemia de coronavirus, Además, permitir el regreso de personas que quedaron varadas en ambos países.",0,"El Comercio"
"El alza en la planilla del servicio eléctrico, referido por ciertos usuarios, ha generado inquietudes en los clientes que han recibido ya la factura de energía eléctrica. Esto debido a que en los últimos meses se han aplicado ciertos cambios para la fijación de estos valores.",0,"El Comercio"
"Los jueces Iván Saquicela, Daniella Camacho y David Jacho, de la Corte Nacional, negaron tarde de este martes, 23 de junio del 2020, el pedido para levantar la prisión preventiva del asambleísta Daniel Mendoza.",0,"El Comercio"
"La pandemia por el covid-19 llevó a que las actividades por el Día Internacional del Orgullo Lgbti 2020 se realicen de manera virtual. En este año, colectivos ecuatorianos realizarán foros, encuentros literarios, presentaciones artísticas y demás para celebrar esta fecha, que se conmemora cada 28 de junio.",0,"El Comercio"
"El Instituto Oceanográfico de la Armada del Ecuador (Inocar) redujo la alerta inicial de posible tsunami a perturbaciones de ola de hasta 30 centímetros en las islas Galápagos. La advertencia se dio tras el terremoto de magnitud de 7.5, registrado en México la mañana de este 23 de junio, frente a las costas de Oaxaca, en el Océano Pacífico.",0,"El Comercio"
"El Instituto Oceanográfico de la Armada del Ecuador (Inocar) y su Centro Nacional de Alerta de Tsunamis informaron a las 12:53 que “se prevé perturbaciones de ola” en Galápagos, tras el sismo de más de 7.5 grados registrado en México la mañana de este martes 23 de junio del 2020.",0,"El Comercio"
"Un sismo de magnitud 7.5 grados se registró la mañana de este martes 23 de junio del 2020 en el sur de México, con epicentro en Oaxaca, informó el Servicio Sismológico Nacional, en un evento que dejó al menos una persona fallecida y activó alertas de tsunami en la región.",0,"El Comercio"
"El exalcalde de Guayaquil, Jaime Nebot, anunció que en esta semana dará a conocer su decisión respecto a una eventual candidatura presidencial de cara a las elecciones del 2021.",0,"El Comercio"
"El Comité por la Institucionalización Democrática pidió a la Asamblea Nacional que con ""urgencia"" tramite la propuesta de reforma parcial a la Constitución que impulsa este colectivo, entre otros temas, para eliminar al Consejo de Participación Ciudadana y Control Social (Cpccs).",0,"El Comercio"
"Las tareas de los guardaparques van desde fabricar títeres para entretener a los visitantes más pequeños de las áreas protegidas hasta apagar incendios o escribir artículos científicos sobre la flora y fauna de las zonas que monitorean.",0,"El Comercio"
"Las tarifas de luz que tuvieron un cobro excesivo tras los meses de confinamiento por el coronavirus en Ecuador serán revisadas. Además, los gerentes de empresas eléctricas serán reemplazados, este anuncio lo hizo el presidente de Ecuador, Lenín Moreno, durante una cadena nacional la noche este este 22 de junio del 2020.",0,"El Comercio"
"Los destellos de un castillo pirotécnico iluminan las siluetas de los asistentes. Las explosiones de la pólvora, las risas y la música forman parte del festejo por el Día del Padre. Es la noche del sábado y el video de la celebración se divulga por medio de las redes sociales desde Quito.",0,"El Comercio"
"Manténgase informado con el podcast: Entérese con EL COMERCIO. A continuación, los temas de este lunes 22 de junio del 2020.",0,"El Comercio"
"Al término de cada año escolar era común que los niños y adolescentes cambien la rutina académica por otro tipo de actividades que se ofrecen en distintos cursos vacacionales. Este año, las reglas han cambiado debido a la crisis sanitaria por covid-19 y mientras las reuniones sociales estén restringidas, las actividades lúdicas en casa y los cursos ‘online’ pasan a ser la principal alternativa.",0,"El Comercio"
"La empresa Panavial, concesionaria de la carretera E-35, iniciará máximo en julio del 2020 las obras emergentes, en la vía Panamericana, en el tramo que conecta a las provincias de Imbabura y Carchi.",0,"El Comercio"
"Entre el 1 y 7 de julio del 2020, los padres o representantes legales de los estudiantes de segundo de Educación General Básica a Segundo de Bachillerato deben entregar el portafolio con las actividades realizadas durante los meses en los que se desarrollaron las clases virtuales. Es la suma de deberes y otros trabajos, más que nada en planteles fiscales. En los privados se han enviado de forma digital, a diario.",0,"El Comercio"
"Carlos Luis Morales me inspiró un cuento, que se titula ‘El último partido’, incluido en mi libro ‘El buitre soy yo’ del 2004. Cuando lo escribí, Morales estaba al borde del retiro pero había luchado por regresar a la Tricolor, en la época del ‘Bolillo’ Gómez. Al final, el puesto de tercer arquero se lo quedó Jorge Corozo, de Olmedo, y Morales aceptó que su carrera había llegado a su fin. Esa imagen de rodillas, con el buzo de pecho multicolor que incluso acabó convertida en un cuadro, festejando el penalti tapado a José Serrizuela, quedaba muy lejana. Ya no era el mismo.",0,"El Comercio"
"Este lunes 22 de junio del 2020 el Registro Oficial publicó la Ley Orgánica de Apoyo Humanitario, que contiene reformas laborales impulsadas por presidente de Ecuador, Lenín Moreno, en el contexto de la crisis del covid-19. De esta manera, el cuerpo legal entró en vigencia.",0,"El Comercio"
"El número de personas contagiadas con covid-19 en Ecuador subió a 50 915 este lunes 22 de junio del 2020, con un aumento de 275 casos en las últimas 24 horas, de acuerdo con el informe N° 116 del Comité de Operaciones de Emergencia Nacional.",0,"El Comercio"
"En una semana habrán pasado ya cuatro meses desde el anuncio del primer caso de covid-19 en Ecuador. El país, dicen especialistas, no ha logrado establecer un sistema de diagnóstico oportuno. Esto permitiría captar y aislar casos y darles un tratamiento rápido; a la par, evitar más contagios.",0,"El Comercio"
"El bienestar primó sobre la belleza, ambas áreas de la industria cosmética, a partir de la emergencia sanitaria. Esto se refleja en las conductas de compra local y en informes internacionales.",0,"El Comercio"
"Cerca de 600 funcionarios, entre guardaparques, jefes de área, técnicos y especialistas del Sistema Nacional de Áreas Protegidas de Ecuador fueron desvinculados de sus puestos de trabajo, según informó la Asociación de Guardaparques del Ecuador (AGE). La noticia les llegó a través de un memorando enviado por el Ministerio del Ambiente y Agua (MAAE) el viernes 19 de junio del 2020.",0,"El Comercio"
"Los casos de covid-19 continúan subiendo en la provincia de Esmeraldas. En siete días se registraron 297 nuevos contagios de coronavirus, debido a la desobediencia de las personas que se resisten a cumplir con las medidas de bioseguridad.",0,"El Comercio"
"Este domingo 21 de junio se celebra el Día del Padre en Ecuador y otros países del mundo. Esta celebración tiene cerca de 110 años de antigüedad y fue una mujer estadounidense la encargada de proponer que se rinda un homenaje a los padres el tercer domingo de junio de todos los años.",0,"El Comercio"
"En este 2020, las celebraciones por el Día del Padre fueron diferentes en centros geriátricos de la capital, en donde rigen las prohibiciones de ingreso de personas externas, por la pandemia del covid-19. En estos espacios se desarrollaron actividades entre los trabajadores y los residentes, pero también se mantuvo el contacto con los familiares, por medio de videollamadas o llamadas telefónicas.",0,"El Comercio"
"A diferencia de la Sierra y la Costa, la Amazonía es la región con un menor número de casos de covid-19 en el Ecuador: 3 632 hasta el 19 de junio. Pero sus 6 provincias afrontan una expansión del virus este mes.",0,"El Comercio"
"El parque Matriz de Cotacachi, en la provincia de Imbabura, amaneció cerrado este 20 de junio del 2020. Personal del Municipio colocó cintas plásticas de color amarillo en los accesos de este espacio verde, en donde las comunidades kichwas del cantón realizaban la Toma de la Plaza. Se trata de un ritual que se repetía cada año, como parte del Inti Raymi, antes y después del 21 de junio.",0,"El Comercio"
"Para este Día del Padre no se quiere que haya más enfermos con el covid-19, como ocurrió luego de las celebraciones del Día de la Madre, del 10 de mayo del 2020.",0,"El Comercio"
"La temporada de anidamiento de tortugas marinas empezó en las costas del Ecuador, especialmente en las playas de Esmeraldas, donde se registran los dos primeros nidos con 112 y 77 huevos cada uno.",0,"El Comercio"
"La Embajada de los Estados Unidos en el Ecuador anunció que financiará USD 31,4 millones para asistencia de migrantes en Ecuador. Esto, con motivo del Día Mundial de los Refugiados, que se celebra hoy, sábado 20 de junio del 2020.",0,"El Comercio"
"La Unión Europea (UE) trabaja con sus contrapartes del Sistema de Naciones Unidades para “reducir las vulnerabilidades” de los refugiados en Ecuador. Así lo señala en un comunicado la Delegación de la UE en Quito, a propósito del Día Mundial de los Refugiados que se conmemora este sábado 20 de junio del 2020.",0,"El Comercio"
"Los pasajeros del transporte interprovincial en Guayaquil deberán cumplir ciertas reglas de bioseguridad para evitar la propagación del covid-19. A más de las actividades de cuidado y desinfección, los viajeros tienen que entregar información personal de residencia y lugar de destino. Los datos permitirán a las autoridades localizarlos, en caso de contagio de covid-19.",0,"El Comercio"
"Ecuador registró 634 casos nuevos de covid-19 en las últimas 24 horas y la cifra total de contagios llega a 49 731, de acuerdo con el informe N° 113 del Comité de Operaciones de Emergencia (COE) nacional emitido este 19 de junio del 2020.",0,"El Comercio"
"Antes de la pandemia, el equipo de Severo, una editorial que publicó su primer libro en noviembre del 2019, tenía planificado lanzar cuatro títulos para este 2020, entre ellos una antología de la obra poética de Roy Sigüenza. Ahora su objetivo es lograr la publicación de, al menos, dos títulos, para el último trimestre del año y así continuar con el proyecto.",0,"El Comercio"
"Las escuelas rurales de la Costa retomarán sus actividades de forma paulatina a partir del 15 de julio del 2020. Así lo anunció el presidente de la República, Lenín Moreno, la noche de este jueves 18 de junio del 2020, en su cuenta de Twitter.",0,"El Comercio"
"En los días previos a una fecha especial, en este caso el Día del Padre, las courier de la capital azuaya se llenan de personas que pugnan por enviar alimentos y regalos a sus seres queridos que viven en Estados Unidos.",0,"El Comercio"
"La Agencia de Control de las Telecomunicaciones (Arcotel) recordó que es una responsabilidad de las operadoras de servicios de telecomunicaciones el contar con mecanismos efectivos para la atención de los reclamos de usuarios. Mediante un comunicado emitido este jueves 18 de junio del 2020, esa entidad informó que se realizan controles sobre esa obligación.",0,"El Comercio"
"Un tribunal de Ecuador dispuso que el Ministerio de Salud busque y atienda a indígenas amazónicos waorani afectados por el coronavirus, ante el temor de que la pandemia sea catastrófica para ellos, según una resolución judicial conocida el jueves, 18 de junio del 2020.",0,"El Comercio"
"Los altos costos del servicio de energía eléctrica que han referido algunos usuarios luego de que se retomara la lectura del consumo en los medidores y se emitieran las facturas “reales” motivó a que el Gobierno estableciera nuevas tarifas.",0,"El Comercio"
"El tiburón oceánico y cuatro especies de martillo ahora cuentan con más protecciones en Ecuador. La prohibición de comercializar y exportar sus aletas busca asegurar la conservación de sus poblaciones en el país.",0,"El Comercio"
"Las Unidades de Cuidados Intensivos (UCI) normalmente acogen a pacientes que requieren monitoreo médico continuo y ayuda respiratoria complementaria, por ejemplo, quienes fueron operados del corazón o salieron de neurocirugía. Pero hoy las necesitan principalmente los contagiados con covid-19 que desarrollan síntomas graves.",0,"El Comercio"
"El virus Nipah no tiene el mismo nivel de efectividad para el contagio que el covid-19. Así lo afirman dos expertos consultados por este Diario.",0,"El Comercio"
"La curva de contagios sigue en ascenso en la capital azuaya. Entre el 10 y 17 de junio del 2020, aparecieron 174 nuevos casos de covid-19. Las autoridades de salud trabajan en el incremento de camas en las Unidades de Cuidados Intensivos (UCI).",0,"El Comercio"
"Los chicos que cursan el tercero de bachillerato en el régimen Sierra y Amazonía vivirán de forma distinta el fin de la época colegial. El próximo 30 de junio del 2020 terminará el año lectivo 2019-2020 y las celebraciones grupales para los que terminan la secundaria, como para todos, no se podrán realizar como antes de la llegada del covid-19.",0,"El Comercio"
"En contagiados muy graves, la nueva cepa de coronavirus produce una inflamación total del cuerpo, conocida como tormenta de citoquinas. Esta reacción puede provocar la muerte. Frente a eso, científicos probaron con dosis de dexametasona, para combatir este tipo de reacción.",0,"El Comercio"
"El consumo de pescado en el mundo continúa en aumento, al igual que el porcentaje de poblaciones de peces que están sobreexplotadas. Ante este escenario, la aplicación de una pesca responsable se vuelve indispensable para asegurar no solo la conservación de las especies, sino que el recurso esté disponible en las próximas décadas.",0,"El Comercio"
"El sector comercial de Manabí se ha reactivado en nueve cantones, pero con bajas ventas.",0,"El Comercio"
"Plantas para aliviar el dolor de cabeza, cicatrizar heridas o detener hemorragias son parte de la diversidad de flora que se puede encontrar en la comunidad de San José de Payamino. Sus habitantes han decidido compartir sus conocimientos en un libro publicado este mes.",0,"El Comercio"
"Un proyecto que promueve la solidaridad se desarrolla en Esmeraldas por iniciativa de la Pontificia Universidad Católica del Ecuador, sede de Esmeraldas (PUCE), desde hace 15 días.",0,"El Comercio"
"En febrero del 2020, el Banco Mundial señaló que el principal desafío de Ecuador es “asegurar la continuidad y fortalecimiento del modelo de salud”, así como su sostenibilidad en contextos desfavorables. Ante ello, el organismo recomienda el uso eficiente de recursos destinados en este sentido.",0,"El Comercio"
"El representante de la Asociación Ecuatoriana de Médicos Posgradistas y la Presidenta de la Federación Nacional de Enfermeras comparecerán a la Comisión de Salud de la Asamblea Nacional, este miércoles 17 de junio del 2020.",0,"El Comercio"
"El papa Francisco realizó una donación de dos respiradores a Ecuador para el tratamiento del covid-19. Así lo informó, la tarde de este martes 16 de junio de 2020, la embajada de Ecuador ante el Vaticano.",0,"El Comercio"
"A través de un veto parcial, el presidente de la República, Lenín Moreno, hizo 16 observaciones a la Ley de Ordenamiento de las Finanzas Públicas. El documento del Ejecutivo se entregó a la Asamblea Nacional el 15 de junio del 2020.",0,"El Comercio"
"El número de casos confirmados de covid-19 en Ecuador se situó este martes 16 de junio del 2020 en 47 943, con un aumento de 621 casos respecto a los diagnosticados el día anterior (15 de junio), según el balance del Comité de Operaciones de Emergencia (COE) Nacional.",0,"El Comercio"
"La reactivación de los vuelos internacionales desde y hacia Ecuador continúa. KLM anunció que desde hoy, martes 16 de junio de 2020, retoma su operación comercial entre Ecuador y Holanda, luego de la reapertura del aeropuerto internacional Mariscal Sucre.",0,"El Comercio"
"Defender la vida y su dignidad, así como superar diferencias e intereses particulares, plantea el Foro para la Acción Democrática en un comunicado fechado el 15 de junio del 2020, como salida para evitar que Ecuador se convierta en un ‘Estado fallido’.",0,"El Comercio"
"Este 15 de junio del 2020, el Comité de Operaciones de Emergencia de Portoviejo (Manabí) decidió que el 18 de junio pasará al semáforo amarillo. Desde el fin de semana, el COE se ha reunido para evaluar los informes sobre la economía del cantón y la curva epidemiológica.",0,"El Comercio"
"El pleno del Consejo de Participación Ciudadana y Control Social (Cpccs) resolvió devolver al Ejecutivo la terna que había remitido para designar al titular de la Superintendencia de Ordenamiento Territorial. La decisión se adoptó en la sesión plenaria efectuada este lunes, 15 de junio del 2020.",0,"El Comercio"
"En este primer día de autorización del transporte interprovincial solo funcionaron las rutas desde Manta hacia Ambato y Quevedo. La terminal de Ambato tiene previsto enviar dos unidades desde las 20:00 de este lunes 15 de junio del 2020 hacia Manta y Babahoyo.",0,"El Comercio"
"Este 15 de junio del 2020 se restablecieron las actividades y la atención al público en los juzgados Civiles y tribunales de lo Contencioso Administrativo y Tributario del país.",0,"El Comercio"
