"Noticia","Tipo","Pagina"
"El ciudadano detenido en Otavalo, dijo ayer que estaba embarazado, pero al ver que nadie le creyó, dijo haber dado positivo para el Covid-19, así como Cynthia Viteri, y pide que la policía no lo moleste y lo deje pasar la cuarentena junto a su esposa.",1,"El Uninverso"
"Estudios de Yachay confirman que el #coronavirus puede propagarse a través de la señal inalámbrica de WIFI, y recomiendan a la población mantener apagados sus modems para evitar la propagación del virus.",1,"El Uninverso"
"El ex Alcalde Jaime Nebot, en entrevista radial aseguró no temer haber sido contagiado del Coronavirus. El explicó que a manera de prevención el desde hace varios años se acostumbró a dar palmaditas o nalgadas a sus funcionarias cercanas, esto con la finalidad de evitar contacto de gérmenes que se pueden pasar al saludar con beso.",1,"El Uninverso"
"La Secretaría de Riesgos informó esta mañana que los ecuatorianos que hayan sacado ""cuarto aparte"" a sus parejas, tendrán derecho a salvoconducto para realizar la visita conyugal 2 veces a la semana. Para tramitar el salvoconducto solo hace falta el nombre de la víctima, un contrato de arrendamiento y la direccón.",1,"El Uninverso"
"Un estudio del INEC, revela que el estar guardados en la #cuarentena ha disminuido la infidelidad de los ecuatorianos hasta en un %99.9. Siendo el %0.01 los casos de manabitas que hacen cuarentena con varias primas en la misma casa.",1,"El Uninverso"
"El Presidente Moreno decretó en cadena nacional que quedan terminantemente prohibidos las aglomeraciones en los Grupos de Whatsapp, y limitó a un máximo de15 usuarios por grupo, esto con la finalidad de frenar el contagio del Coronavirus, aseguró.",1,"El Uninverso"
"El medio ambiente de la cuidad de Quito empieza a limpiarse con la cuarentena. Luego de 60 años el Río Machángara ha vuelto a verse cristalino, lo que ha permitido que regresen algunas especies como los delfines de río, los cuales se los han visto nadando libremente según varios moradores de la capital.",1,"El Uninverso"
"Miles de ecuatorianos que pensaban que el #Teletrabajo iba a ser fácil, hoy se encuentran extrañando su oficina. Porque los jefes les llaman desde tempranito, mientras los guaguas le piden el desayuno, luego le llaman cuando acaban de salir de la ducha, y no pueden ni peinarse. Las llamadas y videoconferencias continúan a lo largo del día hasta las 7pm y en otros casos hasta las 9pm. Ahora todos extrañan volver al trabajo tradicional.",1,"El Uninverso"
"#URGENTE La Organización Mundial de la Salud pide a los ecuatorianos ayudar a encontrar a estos 3 científicos, para que dicten conferencias internacionales indicando sus teorías sobre la eliminación del #Coronavirus con arena alcalina y agua de Laguna.",1,"El Uninverso"
"Una buena noticia para pasar la #cuarentena, Ecuavisa adelantará la transmisión de Mi Pobre Angelito y de TurboMan porque todavía no se tiene ninguna certeza de que los ecuatorianos lleguemos vivos hasta fin de año.",1,"El Uninverso"
"Un nuevo percance sufrió esta mañana el Ex Presidente Rafael Correa, cuando se dispuso regresar a su casa para pasar con su familia la cuarentena ordenada por el Gobierno de Bélgica. ""Intenté 3 veces y mi llave ya no funcionaba, luego me di cuenta que mi familia me había cambiado la chapa, para evitar pasar conmigo la cuarentena"" aseguró el ex mandatario, quien presentó una orden judicial para que le permitan ingresar a su domicilio.",1,"El Uninverso"
"La alcaldesa de Guayaquil, Cynthia Viteri asumió la culpa de no haber dejado aterrizar al Avión de Iberia. según ella fue por cumplir con las indicaciones del Gobierno en las cuales se indicaba que solo los vehículos con placa terminada en número PAR podría circular en el país. ""el avión es un vehículo arereo, y no me especificaron eso en el decreto, y su placa terminaba en 2"" aseguró.",1,"El Uninverso"
"Buenas noticias para los hinchas. La FEF comunicó que la LDU y El Nacional tienen permiso para jugar sus partidos con públicos, ya que cumplen las reglas de prevención al aglomerar menos de 30 personas en un solo evento. Felicitaciones.",1,"El Uninverso"
"Varios fanáticos de la Serie #LaCasaDePapel se quedarán sin poder ver su 4ta temporada. Todo gracias a los desesperados que vaciaron las perchas del #supermaxi, acabándose así con todo el papel higiénico.",1,"El Uninverso"
"La Asambleísta del correísmo Wendy Vera,  explicó muchas ventajas del Teletrabajo, ""Quedarse en casa es mucho mejor, en mi casa tengo banda ancha y puedo hacer las compras online más rápido y así ahorro tiempo para poder pasar acostada o cantando que es lo que más me gusta"". aseguró. Ella es la asambleísta con más faltas en la asamblea, pero cada fin de mes es la primera en acercarse a firmar el rol de pagos para cobrar el sueldo. Hasta la Victoria Siempre!",1,"El Uninverso"
"El famoso actor Tom Hanks, informó que su compañero Wilson también presentó síntomas de #coronavirus luego de haberlo saludado sin lavarse las manos. Fuentes oficiales indicaron que la pareja se encuentra en cuarentena a la espera de resultados.",1,"El Uninverso"
"Debido al #Coronavirus, La Arquidiócesis ha creado su canal de youtube para oficiar las misas, y piden a todos los feligreses realizar el pago de la limosna vía #paypal o transferencia bancaria. Además se informa que el envió de la Hostia se lo realizará por #UberEats",1,"El Uninverso"
"Luego del anuncio que realizó el Presidente Moreno de fusionar varios Ministerios entre ellos del de Transporte y Telecomunicaciones, se ha anunciado la posibilidad de contratar a Goku Son como Ministro de Teletransportaciones, ya que se ha demostrado una amplia experiencia en el tema. El anuncio oficial se lo hará en las próximas horas.",1,"El Uninverso"
"Asambleístas se niegan a pagar un porcentaje por sus autos con avalúos mayores a USD $20.000, ""Esto es un robo, nosotros estamos dispuestos a poner el hombro y ayudar al país, siempre y cuando no nos toque pagar nada"" aseguró el Asambleísta de CREO Hector Yepez.",1,"El Uninverso"
"Dirigentes del transporte y ciudadanos en general, anunciaron un Paro Nacional contra el Gobierno, por haberles hecho hacer una fila de 2 horas y no haber subido los combustibles como se aseguraba en las redes sociales.",1,"El Uninverso"
"Desde ahora las Trabajadoras Sexuales tendrán que usar mascarillas y tapabocas, además se prohíbe el contacto previo para evitar contagios, como parte de la campaña ""Si estás tosiendo, apúrate metiendo"" que impulsa el Ministerio de Salud para prevenir la propagación del #coronavirus en estos centros de diversión masculina.",1,"El Uninverso"
"El CNE informó esta tarde que el Ex Presidente Rafael Correa no tendrá ningún impedimento para ejercer su candidatura para las próximas elecciones en el Centro de Reclución de #Latacunga, ya que esa no es jurisdicción del CNE, sino del Ministerio del Interior y es el derecho de cualquier convicto.",1,"El Uninverso"
"Polémica Chef llegó al Ecuador, se trata de Helen Chufe, quien fue la creadora del Caldo de Murciélago. Ella tiene previsto visitar el Mercado Municipal Caraguay para explicar el proceso y realización de este famoso plato. ""Es falso decir que el #Coronavirus se originó en los murciélagos, porque si se lo hierbe bien se mueren todas las bacterias"" aseguró la chef.",1,"El Uninverso"
"La Prefecta de Pichincha, se pronunció esta mañana sobre el mal estado de las vías Calacalí-La Independencia y Aloag - Santo Domingo. ""No es nuestra prioridad por ahora arreglar las vías, estamos en campaña y es mejor evitar que vengan los contagiados a nuestra provincia"" enfatizó.",1,"El Uninverso"
"La alcaldesa de Guayaquil, Cynthia Vireri anunció una campaña llamada ""muerto el perro se acaba la rabia"", enfocada en eliminar el #coronavirus de Guayaquil. Pidió a la policía estar atenta a personas que anden sin mascarillas en lugares públicos. ""Si ven que tose, y no tiene mascarilla, disparen"" fue la instrucción que les dio a los gendarmes.",1,"El Uninverso"
"Un estudio científico realizado en Yachay, asegura que Los correístas son menos propensos a contraer el Coronavirus, por ser gente honesta y trabajadora de Manos Limpias y Corazones Ardientes.",1,"El Uninverso"
"Según un último reporte de la OMS, los hinchas de la Liga de Quito serían inmunes al Coronavirus, ya que se detectó que ellos todavía viven en el año 2008, y el virus apenas salió a finales del 2019.",1,"El Uninverso"
"Según Rafael Correa, tenía previsto presentarse en su juicio en Ecuador, pero lastimosamente los casos de #coronavirus, le hicieron replantearse su viaje. ""Yo no soy cobarde, yo no tengo miedo en volver al Ecuador, solo que he pasado ocupado y por eso no he ido."" asegurpo el ex mandatario.",1,"El Uninverso"
"El Prefecto del Azuay, volvió a solicitar 20 días de vacaciones, está vez para según él, encontrar una cura para el #coronavirus a través de la medicina ancestral. Aseguró que estos días se adentrará al páramo para hacer varias pruebas con ishpingo, rábanos y miel de abeja.",1,"El Uninverso"
"Alcaldesa de Guayaquil, hace un llamado para que los guayaquileños aprovechen esta temporada de vacaciones escolares para visitar las otras regiones del Ecuador, como la Sierra y el Oriente. ""Mientras menos gente haya en la ciudad, más dificil es que se presenten mas casos de coronavirus, vayan y disfruten del páramo"" aseguró.",1,"El Uninverso"
"Desde este Lunes 2 de marzo María Angélica Santos se intregará al cabildo  para prestar sus servicioscomo Asistente de Despacho, con un sueldo de  $3500. Según el alcalde la contratación se la hace para dar la oportunidad a más mujeres para que se puedan desempeñar en altos cargos en las instituciones públicas.",1,"El Uninverso"
"La Ministra de Salud informó que serán más estrictos en el control y registro de pasajeros infectados con #Coronavirus. ""Tenemos una mesa de registro, y nadie la utiliza, así que analizamos la posibilidad de cobrar una fuerte multa a los turistas que tengan #Coronavirus y que no se hayan registrado en su ingreso"" aseguró.",1,"El Uninverso"
"Esta mañana fue capturada Elsa Pito, quien el fin de semana habría fingido estar secuestrada, para poder pasar todo el feriado de Carnaval con su amante. Su esposo dio aviso a la policía luego de que no llegó a dormir 2 noches seguidas, acto seguido se realizó un operativo en varios moteles de la capital, dónde se encontró a la supuesta secuestrada.",1,"El Uninverso"
"La Ministra de Salud, Catalina Andramuño, se pronunció ante la especulación y  subida acelerada del precio de las máscaras para evitar el #Coronavirus. Aseguró que los precios deberían mantenerse y que no podemos permitir que ahora se las venda más carillas.",1,"El Uninverso"
"El Dirigente indígena, Jaime Vargas exige al alcalde de Guaranda ser reconocido oficialmente como Segundo Taita Carnaval 2020.",1,"El Uninverso"
"Muy molesta fue vista Lorena Collantes, quién disfrutaba del feriado en las playas de Salinas y al salir, se dió cuenta que estaba embarrada con una materia café. Al ser entrevistada envió un fraterno saludo al alcalde ""Si no puede ni manejar las aguas servidas este HP, que se vaya a la Ve%$, ese cara de VEr$$%"", además dijo que iba a levantar una queja con su novio el mafioso más mafioso para solucionar este problema.",1,"El Uninverso"
"El Alcalde de Salinas, Daniel Cisneros, aseguró que el desfogue de agua hacia la playa se trató de un imprevisto. ""Me invitaron a una cangrejada, pero los cangrejos al estar mas de 8 días en veda, estaban guardados, entonces nos hizo mal, y todos los  baños de la casa quedaron tapados, no podíamos seguir así hasta el miércoles"" aseguró, y como último recurso para destaparlos se realizó la apertura de las tuberías y así se solucionó el problema",1,"El Uninverso"
"Polémicas declaraciones en rueda de prensa dejaron consternados a varios periodistas cuando el dirigente indígena Jaime Vargas, se auto proclamó, Segundo Presidente del Ecuador, Hijo de Odín, Hombre de Acero, Hermano de Neptuno, comandante de los Ejércitos del Norte y Padre y Madre a la vez.",1,"El Uninverso"
"El Ministerio de Educación anuncia cambios en las pruebas #SerBachiller, que ahora tendrán el nombre de #SerGabriela, en honor a Gabriela Rivadeneira, la primera ecuatoriana en lograr la Presidencia de la Asamblea con apenas el título de Bachiller.",1,"El Uninverso"
"Mas de 100 Exámenes #SERBACHILLER serán enviados al Laboratorio de Houston para realizar el respectivo análisis que determinará si los estudiantes copiaron o no, luego del escándalo sobre la filtración de las preguntas del examen. La Ministra espera que en 7 días podamos tener los resultados.",1,"El Uninverso"
"Este viernes 14 de Febrero se hará un contraflujo ""TODO NORTE"" desde el redondel el labrador hacia los diferentes moteles que se encuentran en la 10 de Agosto. Esto para evitar que los quiteños duren mas tiempo en el tráfico que en el ""matadero"" aseguró el Alcalde.",1,"El Uninverso"
"La Prefecta de Pichincha  pide a la fiscalía que se les retire el ""grillete de la dignidad” para poder pasar San Valentín con más comodidad en el ""cuerpeo intenso"", y luego poderse bañar sin problemas en el jacuzzi.",1,"El Uninverso"
"La policía anda en búsqueda de Alias ""#COLORADO"" quien junto a su compañero que se disfrazó de policía ingresaron  al Hospital de Esmeraldas para acabar con la vida de un reo que estaba siendo custodiado. Las cámaras de seguridad grabaron los hechos en lo que parece ser sacado de una película de acción. Se presume que el Colorado regresó a su tierra natal Chone.",1,"El Uninverso"
"Conforme avanzan las audiencias del #CasoSobornos, la posibilidad de una candidatura de Rafael Correa es cada vez más lejana. Esto ha obligado al ex mandatario a realizar un singular ofrecimiento. “Tengo unas cuentas en China, donde se depositaron varias comisiones y acuerdos entre privados, nada ilícito” aseguró, que podría darnos la mitad, de este dinero que tenía guardado para su jubilación a cambio de permitírsele ser candidato en el 2021. Según fuentes extraoficiales las otras cuentas pertenecerían al ex  vicepresidente Jorge Glas.",1,"El Uninverso"
"Habitantes del Carapungo, buscan formar un nuevo Cantón ""Pungo´s face City"", esto según informan sus autoridades barriales ""no queremos ese alcalde y queremos evitar mezclarnos con el resto de los quiteños quienes vienen a nuestro barrio a robar y delinquir"" 
El alcalde Yunda tiene pensado reunirse con los dirigentes barriales este fin de semana.",1,"El Uninverso"
"Luego de revisar su base de datos, la Embajada de China emitió un comunicado dónde niega que el paciente infectado con Hepatitis sea Chino. Al parecer al ver sus ojos rasgados y no poderle entender, los médicos dieron por sentado que era de nacionalidad china. ""Conforme informes de migración hoy pudimos saber que en realidad es Coreano y que nunca ha visitado China"" informó la Ministra.",1,"El Uninverso"
"Un grupo de Agentes Civiles de Tránsito realizó un plantón esta mañana, exigiendo que se mejore el valor de las ""COIMAS"", aseguran que los $5 dólares ""para las colas"" ya no alcanzan y que cada vez mas sacrificado estar haciendo operativos bajo el solazo que azota a la capital. ""Pónganse en nuestros zapatos, necesitamos hidratarnos, y comprar protector solar, con $5 no alcanza"" aseguró el Agente a cargo de la protesta.",1,"El Uninverso"
"Gran polémica ha desatado la filtración de una fotografía aficionada que muestra al ex Presidente Rafael Correa disfrutando del #SuperBowl2020 en una de las locaciones más caras del Hard Rock Stadium de Miami. El ex Presidente por su parte no ha desmentido esta noticia, mientras que sus compañeros de bancada afirmaron que Correa viajó a Miami por unos asuntos personales.",1,"El Uninverso"
"El Quarterback Josh Zambrano Nichols, estrella del #SuperBowl2020, tiene descendencia ecuatoriana, su padre, un migrante nacido en Portoviejo llegó hace 20 años a Miami donde conoció a Samantha Nichols, luego de unos meses vino a Ecuador a dar a luz a su hijo, quien tiene doble nacionalidad. El próximo mes Josh Zambrano visitará a su familia en Manabí y recibirá una medalla por parte del Ministerio de Deportes del Ecuador.",1,"El Uninverso"
"Varias revistas internacionales hablan de la participación de la microbióloga ecuatoriana, quien se destaca a nivel internacional, al ser una de los 6 miembros encargados por la OMS para  buscar la cura para el #Coronavirus. Su fórmula a base de miel de abeja y cebolla ha dado un alto grado de efectividad, siendo así una de las que encabezan el este grupo de expertos. Un orgullo para nuestro país.",1,"El Uninverso"
"""Eliminen la prueva ser Bachiller"", es lo que exige el ex candidato presidencial Guillermo Lasso. Luego de haberse sometido a la evaluación y haber sacado una pésima calificación. Lasso nunca temrinó la Universidad y cree que es el momento de retomar sus estudios.",1,"El Uninverso"
"Si eres de lo que te tomas las fotos en el espejo cuando vas al Gym, y te gusta estar dando consejos de nutrición y rutinas de ejercicios a tus compañeros como todo un profesional. Ahora puedes reclamar en el SENESCYT tu título de Nutricionista y COACH (Personal Trainer) 
Para esto solamente es necesario una foto en el Gym y tu código de descuento de tu batido de Herbalife.",1,"El Uninverso"
"Una fuerte polémica se originó a partir del anuncio de Maria Alejandra Vicuña al poner en subasta su nombramiento de Jefe de Recursos Humanos en el SRI. Según la publicación se indica un precio base de $25000 para el traspaso del nombramiento. Según el abogado de Vicuña, este dinero servirá para pagar parte de la fianza de $175.000 a la cual fue sentenciada Vicuña este jueves.",1,"El Uninverso"
"Siguen las inconsistencias luego de la Rueda de Prensa organizada por la Defensoría del Pueblo y el FUT,  donde se mostró la fotografía del supuesto ciudadano muerto durante las protestas. Según Freddy Carrión, ""José Chaluisa"" fue desaparecido inicialmente y luego se lo encontró muerto. Pero la fotografía presentada era de Jordy ""El Niño Polla"" conocido actor español de la industria del porno.",1,"El Uninverso"
"Según comunicado de la OMS, los murciélagos son primos hermanos de los cuyes, y pueden ser fácilmente contagiados por el #Coronavirus. Se pide a la ciudadana evitar comer cuy mientras dure la emergencia.",1,"El Uninverso"
"El dirigente indígena se refirió a las inconsistencias encontradas en la Lista de Fallecidos entregada a la CIDH. ""Nosotros cumplimos con avisar quienes murieron, pero si no han muerto todavía, algún rato todos tendremos que morir"" aseguró el dirigente.",1,"El Uninverso"
"La Alcaldesa de Guayaquil Cynthia Viteri decretó esta mañana el cierre del Puente de la Unidad Nacional, luego de verificar la noticia del arribo de un ciudadano chino con #coronavirus a Quito.",1,"El Uninverso"
"Los  Almacenes Juan Eljuri ubicados en la Av. Orellana en Quito, será ocupados como Centros de Cuarentena para pacientes con #coronavirus. Esto debido a que están en un lugar céntrico y estratégico y que nunca tienen gente, aseguró la Ministra de Salud.",1,"El Uninverso"
"Hector Yépez, pide más vacaciones y horas libres para los asambleístas. Dice que es un trabajo muy sacrificado.",1,"El Uninverso"
"La agencia creadora del nuevo logo de la FEF confesó haberse demorado más de 5 meses en el diseño, porque en el contrato se especificó el valor de $150 diarios por cada creativo. ""Esto toma tiempo, y si querían el logo con el condor, nos hubiésemos demorado 4 meses más"" aseguró el Director de la agencia, quien les pagó con pizza gratis y bielas a sus colaboradores.",1,"El Uninverso"
"El Alcalde Jorge Yunda, dio a conocer la fotografía de alias (El Rey Palomo) principal sospechoso del incendio ocurrido en el cerro Casitagua. El Municipio ofrece además una recompensa de $50.000 a quien de información sobre su paradero. Según agentes de inteligencia el pirómano habría salido de Quito rumbo a Riobamba.",1,"El Uninverso"
"Un gesto digno de #compartir El bombero voluntario Jhonny Zambrano, fue dado de alta esta mañana. Él tropezó y cayó por la quebrada del #Casitagua al encontrarse practicando reanimación cardiopulmonar a su compañera. Ahora los dos se encuentras a salvo.",1,"El Uninverso"
"El líder indígena, Jaime Vargas, solicitó formalmente esta mañana, el pago de regalías #FEF por utilizar los garabatos que el se pinta en la cara para su nuevo logo. ""Es mi creatividad y me deben pagar por ellos si la usan"", aseguró Vargas",1,"El Uninverso"
"Un fuerte olor a cebolla que se apodera de todas las oficinas de la institución. El alcalde Yunda, quien venía de un partido de ecuavoley ha dicho que esto es normal, y debemos acostumbrarnos mientras dure la ola de calor que azota a la capital. ""El Limón ya no es suficiente, pero es un olor a compañerismo que no debe afectarnos"" aseguró.",1,"El Uninverso"
"La ex Asambleísta Gabriela Rivadeneira aseguró que sufre una persecución política, pero no ha desperdiciado ni un minuto desde que llegó a México en mostrar mediante sus Stories de Redes Sociales su lujosa y relajada vida en diversos sitios turísticos de México. Este fin de Semana tiene programado ir a los hoteles de la cadena Xcaret en la Riviera Maya. Además aseguró que está triste por su padre, pero que el tiene que cuidar de sus bienes en Ecuador.",1,"El Uninverso"
"Como un ""Golpe de Suerte"" califica Gabrieal Rivadeneira, el repentino aumento de patrimonio que tuvo su padre en los últimos años. Según investigaciones se encontraron más de $5 millones en patrimonio injustificado. Según Rivadeneira esto se debe a la compra y venta de carros y propiedades en Imbabura.",1,"El Uninverso"
"Los dirigentes de la CONAIE, Iza, Vargas y Lourdes Tibán aseguraron que luego de varias reuniones, se ha decidido que la fecha del #ParoNacional sea el próximo 10 de enero, pero también comunicaron que todavía no se llega a un acuerdo sobre cuales serán las razones de la paralización.",1,"El Uninverso"
"Luego de 8 horas de trabajo, el Municipio decidió dejar la Roca en su sitio, y esculpir en ella la Cara del Alcalde Yunda. ""El trabajo nos quedó muy grande y no tenemos idea de como bajar la piedra, así que decidimos hacer una escultura como la del Diablo de Tandapi, pero con la cara de nuestro alcalde"" enfatizó el Gerente de la Empresa de Obras Públicas.",1,"El Uninverso"
"Esta mañana se reportó la caída de un misil aéreo en El Aromo, según indicaron moradores, se escuchó un estruendoso ruido que terminó desapareciendo toda la Refinería del Pacífico, una obra que costó $1600 MILLONES. Por su parte el ex presidente Glas dijo que se encargará de hacer una nueva refinería si le dan nuevamente el presupuesto.",1,"El Uninverso"
"La activista Blanca Lopez, conocida por sus videos de defensa a favor de Jorge Glas, ha sido contactada por Sony Entertainment para ser la voz oficial de la nueva película de Alvin y las Ardillas en la Vegas. Su característica voz fue escuchada por varios productores los cuales se contactaron para realizar la propuesta.",1,"El Uninverso"
"El abogado del expresidente Jorge Glas, envió un mensaje este 6 de Enero, dónde JG amenaza con el inicio de una nueva huelga de hambre. ""Si no me cambian a la cárcel 4, yo no me serviré la Rosca de Reyes que prepararon mis compañeros de rehabilitación"", los abogados aseguraron que enviaron una carta a la CIDH donde se exige que su defendido pueda comer la Rosca de Reyes.",1,"El Uninverso"
"La Prefecta de Pichincha respondió a las críticas en redes sociales al mostrarse que entraba a su oficina SIN GRILLETE. ""Yo me pongo el grillete para las entrevistas, la jueza que me liberó, me dio la llave, pero me pidió que la devuelva luego de pasar estas fiestas de navidad y fin de año"" aseguró Pabón.",1,"El Uninverso"
"Yasmani Arturo García, denunció esta mañana la pérdida de su gato mecánico, luego de un control en el que un agente de tránsito le solicitó mostrar gata, triángulos y botiquín. Yasmani asegura que necesita encontrar el gato antes de presentarse al centro de matriculación para realizar la revisión de su vehículo. Se ofrece $20 de recompensa a la persona que de información efectiva",1,"El Uninverso"
"Escenas como esta, se repiten a lo largo de la provincia manabita, millones de personas festejaron el triunfo del Delfín en el campeonato nacional. Miles de manabitas no se presentaron el día de hoy a sus trabajos, y varias autoridades piden un día de vacación.",1,"El Uninverso"
"El Ex alcalde de Guayaquil, Jaime Nebot, felicitó al Delfín por su campeonato, y dijo que todos los hinchas del Barcelona también comparten su alegría. ""Este triunfo es de todos, y los perdedores, que se vayan a llorar al páramo"" dijo Nebot.",1,"El Uninverso"
"Fuertes declaraciones de Antonio Valencia, luego de la perdida por penales ante el Delfín de Manta. ""Nos faltó táctica, técnica, y potencia para poder meter los goles, ni Julissa se hubiera mamado tantos penales"" aseguró el jugador.",1,"El Uninverso"
"La Prefecta de Pichincha Paola Pabón gozará de 11 días de vacaciones, sin haber cumplido  ni un año de trabajo. Pero su abogado va más allá, y solicita que le adelantes las vacaciones de Carnaval y Semana Santa del 2020, para que así pueda seguir cobrando su sueldo completo aunque no asista a la Prefectura.",1,"El Uninverso"
