"Noticia","Tipo","Pagina"
"La artista ecuatoriana María de los Ángeles tenía todo preparado para celebrar sus 25 años de trayectoria artística con un concierto virtual, que estaba previsto para el pasado sábado 1 de agosto del 2020. Sin embargo, el evento fue cancelado debido a que la plataforma que ofrecía el servicio de transmisión sufrió un ataque informático.",0,"El Comercio"
"Ecuador negocia acuerdos bilaterales para el combate a la pesca ilegal, no declarada y no reglamentada con Colombia, Perú y Costa Rica, informó a la Asamblea Nacional hoy, lunes 3 de agosto del 2020, el canciller, Luis Gallegos.",0,"El Comercio"
"El presidente de la República, Lenín Moreno, anunció el lunes 3 de agosto del 2020, que Ecuador alcanzó la mayoría necesaria para renegociar los bonos de deuda externa por USD 17 375 millones.",0,"El Comercio"
"Un lobo marino macho de más de dos metros que se encontraba varado en las playas de Rocafuerte, norte de Esmeraldas, fue devuelto a su hábitat natural. En el recate del mamífero participaron funcionarios del Ministerio del Ambiente y de la Policía Nacional, así lo anunció la Cartera de Ambiente la mañana de este 3 de agosto del 2020 en su cuenta de Twitter.",0,"El Comercio"
"Desde finales de junio del 2020, una flota pesquera con más de 300 barcos de gran calado se desplazaba muy cerca de la frontera marítima entre las islas Galápagos y el Ecuador continental. El hecho puso en alerta al Gobierno ecuatoriano debido a la amenaza que esto representa para la biodiversidad de las especies marinas que habitan y circulan por esta zona. Desde el Estado y el sector privado se han planteado varias opciones en el manejo de esta situación.",0,"El Comercio"
"El país vivirá una jornada decisiva en el proceso de reestructuración de USD 17 375 millones en bonos soberanos. Los tenedores de esos papeles tienen hasta este lunes 3 de agosto del 2020 para votar sobre la propuesta de Ecuador.",0,"El Comercio"
"Con inspecciones y revisiones de protocolos, autoridades y hoteleros se preparan para recibir a los turistas en las playas de Esmeraldas, Manabí, Guayas y Santa Elena.",0,"El Comercio"
"Manténgase informado con el podcast: Entérese con EL COMERCIO. A continuación, los temas más relevantes de este lunes 3 de agosto del 2020.",0,"El Comercio"
"Desde este viernes 31 de julio del 2020 en 18 provincias del Ecuador rige un nuevo toque de queda dispuesto por el Comité de Operaciones de Emergencia (COE) nacional ante la propagación del covid-19.",0,"El Comercio"
"Este domingo 2 de agosto del 2020 se recuerdan 210 años de la matanza de los próceres de la gesta de independencia del 10 de agosto de 1809 sin eventos masivos por la pandemia del covid-19 en Ecuador. De hecho, este fin de semana se aplican nuevas medidas de restricción en Quito, la ciudad con el mayor número de contagios del nuevo coronavirus: 13 438 personas infectadas: nuevo horario de toque de queda, prohibición de venta de licor, suspensión de reuniones.",0,"El Comercio"
"Manténgase informado con el podcast: Entérese con EL COMERCIO. A continuación, los temas de este sábado 1 de agosto del 2020.",0,"El Comercio"
"Cuatro hoteles pertenecientes a la Asociación de Hoteles Quito Metropolitano han cerrado sus puertas de manera definitiva. Así lo dio a conocer Norman Bock, presidente de esta agremiación, la noche de este 1 de agosto del 2020.",0,"El Comercio"
"Para seguir a especies en mar abierto, Alex Hearn, catedrático de Biología Marina de la Universidad San Francisco de Quito (USFQ), explica que se usa un transmisor colocado en un animal. Este envía una señal a una red de satélites.",0,"El Comercio"
"El corredor que se forma entre la Zona Económica Exclusiva (ZEE) Continental de Ecuador y la Insular se ha convertido en un punto estratégico para las flotas extranjeras. La llegada de estos barcos, especialmente asiáticos, se repite cada año y se estima que su impacto en la biodiversidad cada vez aumenta. ¿Pero qué es lo que hace que estos se movilicen desde el otro lado del mundo hasta este punto?",0,"El Comercio"
"Manténgase informado con el podcast: Entérese con EL COMERCIO. A continuación, los temas de este domingo 2 de agosto del 2020.",0,"El Comercio"
"El Estado canceló en su totalidad los haberes pendientes por salarios de los empleados del Gobierno central y universidades del mes de junio. Así lo confirmó el Ministerio Finanzas, este 1 de agosto del 2020, a El Comercio.",0,"El Comercio"
"Para el martes 4 de agosto, a las 11:00, está convocada la audiencia de apelación a la prisión preventiva que fue presentada por el asambleísta independiente Eliseo Azuero y otras seis personas.",0,"El Comercio"
"“Fui víctima de una estafa a través de una página de comercio electrónico. Resulta que el viernes, 24 de julio del 2020, compré un celular, porque necesito para trabajar. Pero antes de hacerlo revisé todas las ofertas en la página web y encontré el teléfono que quería y el precio era bueno. No era tan barato con relación al resto de ofertas. Entonces no me pareció ser una estafa.",0,"El Comercio"
"Las operaciones en los terminales de Quitumbe, en el sur de Quito: y Carcelén, en el norte, se mantendrán suspendidas hasta segunda orden. Así lo adelantó la tarde de este sábado, 1 de agosto del 2020, el COE Metropolitano.",0,"El Comercio"
"Muchas personas culpan al teletrabajo o a los juegos en línea de la lentitud del internet, pero lo cierto es que ese problema está estrechamente relacionado con la calidad de la señal Wifi, con la cobertura y con la velocidad del plan contratado. Así lo explica Xavier Moreano, Gerente Nacional de Marketing de Netlife.",0,"El Comercio"
"El 23 de abril de 1993 sus nacimientos en Guayaquil fueron noticia. La llegada de los sextillizos Rodic causó gran expectativa al ser el primer alumbramiento múltiple en Ecuador y en América Latina en ese tiempo.",0,"El Comercio"
"El trabajo de desmontaje de las cabinas de pago manual en el peaje del túnel Guayasamín, en el nororiente de Quito, continúa este fin de semana. Por esa razón, este sábado 1 de agosto del 2020 la circulación vehicular está suspendida. Las obras forman parte del proceso de automatización para colocar un arco de cobro electrónico, para evitar la manipulación de dinero en efectivo en medio del covid-19.",0,"El Comercio"
"Ecuador llega a la semana de la lactancia materna -que se inicia hoy- con resultados alentadores respecto de cifras de años pasados y en comparación con el promedio mundial, según datos oficiales del INEC y de la Organización Mundial de la Salud (OMS).",0,"El Comercio"
"En Quitumbe y Chillogallo, en el sur Quito, desde las 19:00 de este viernes 31 de julio del 2020, se iniciaron los controles del cumplimiento de las nuevas medidas adoptadas por el Comité de Operaciones de Emergencia (COE) nacional.",0,"El Comercio"
"La portavoz de la Organización Mundial de la Salud (OMS), Margaret Harris, dijo que el covid-19 se comporta como una gran ola y que no existe una influencia estacional, es decir que la enfermedad no se ve afectada por las estaciones como sí sucede con otros virus como el de la influenza.",0,"El Comercio"
"Un informe del Servicio Integrado de Seguridad ECU 911 revela que en un mes en Ecuador se registraron incidentes con 64 248 libadores, personas que consumían bebidas alcohólicas infringiendo la restricción por la pandemia del covid-19. El Comité de Operaciones de Emergencia (COE) nacional recogió ese hecho como una de las razones para prohibir la venta de licor de viernes a domingo, desde este 31 de julio del 2020, en Quito y en todos los cantones de 18 provincias (Sierra, Amazonía y dos jurisdicciones de la Costa).",0,"El Comercio"
"El Parque Nacional Cotopaxi está abierto nuevamente para los visitantes. El Ministerio del Ambiente y el Agua informó que esta área protegida fue abierta al público el 29 de julio del 2020. Los turistas pueden visitarlo de martes a domingo, de 08:00 a 15:00.",0,"El Comercio"
"La mortalidad en el Ecuador sigue en escalada con un exceso de defunciones durante los cinco meses de pandemia de 25 519, por lo que es uno de los países más afectados de la Región junto con Perú y Brasil.",0,"El Comercio"
"Una Corte de Manhattan (Nueva York) negó la demanda que presentaron las firmas de inversión Contrarian Capital Management LLC y GMO LLC en contra del Gobierno de Ecuador en el marco del proceso de renegociación de la deuda externa, según confirmó el asesor del Régimen, Augusto de la Torre.",0,"El Comercio"
"Durante la emergencia sanitaria, que se inició el 16 de marzo tras la suscripción del estado de excepción, el Gobierno nacional y las autoridades locales reglamentaron acciones de obligatorio cumplimiento. Con las medidas se busca detener la propagación del covid-19.",0,"El Comercio"
"Ecuador registra este viernes 31 de julio del 2020 un total de 85 355 casos confirmados de covid-19 a escala nacional. 985 nuevos contagios en 24 horas, según el informe 155 del Ministerio de Salud Pública, con corte a las 08:00.",0,"El Comercio"
"El equipo creado para diseñar una estrategia de protección de Galápagos ya empezó a buscar las formas de lograr este objetivo. La iniciativa, liderada por la exministra de Ambiente Yolanda Kakabadse y el exalcalde de Quito y ambientalista Roque Sevilla, está sumando a expertos en el tema para promover iniciativas conservación.",0,"El Comercio"
"Jacobo, Michel y Dalo Bucaram Pulley, hijos del expresidente ecuatoriano Abdalá Bucaram Ortiz, se convirtieron en prófugos de la Justicia. La jueza Gianella Noritzs dictó en su contra prisión preventiva, tras procesarlos penalmente por el presunto delito de asociación ilícita para la venta irregular de insumos hospitalarios al Estado. La resolución se conoció la madrugada de este viernes 31 de julio del 2020, en Guayaquil.",0,"El Comercio"
"Manténgase informado con el podcast: Entérese con EL COMERCIO. A continuación, los temas de este viernes 31 de julio del 2020.",0,"El Comercio"
"Entre el 16 de marzo y el 30 de julio de este año un total de 289 258 contratos de trabajo han finalizado, según datos del Ministerio de Trabajo. No obstante, en ese mismo período, la entidad registra 127 579 nuevos contratos.",0,"El Comercio"
"El Gobierno de Ecuador anunció este jueves 30 de julio del 2020, que extenderá el plazo para que los acreedores voten sobre la propuesta de reestructuración de la deuda de USD 17 375 millones en bonos, que inicialmente estaba prevista para mañana, 31 de julio.",0,"El Comercio"
"“Las IES (instituciones de educación superior) no podrán incrementar el valor de las matrículas, aranceles y derechos en todas las carreras y programas durante los periodos académicos del año 2020”. Esto se establece en la reforma a la Normativa transitoria para el desarrollo de actividades académicas en las instituciones de educación superior, debido al estado de excepción decretado por la emergencia sanitaria ocasionada por la pandemia de covid- 19.",0,"El Comercio"
"La Junta de Beneficencia de Guayaquil (JBG) eligió nuevo directorio. En la sesión del pasado martes 28 de julio de 2020, Juan Xavier Cordovez Ortega fue nombrado director de la entidad para el periodo 2020-2021.",0,"El Comercio"
"Una ballena jorobada joven fue rescatada en Playa Camarones, en Esmeraldas, norte de Ecuador. El rescate del cetáceo se realizó el pasado 29 de julio del 2020 y fue necesaria la participación de guardaparques de la Reserva Marina Galera San Francisco, miembros de la Armada del Ecuador y pescadores de la zona.",0,"El Comercio"
"A los pies del monumento Nuestros Héroes, al norte de Quito, se efectuó un evento especial por el Día Mundial contra la Trata de Personas. En el acto, desarrollado este jueves, 30 de julio del 2020, participó la ministra de Gobierno, María Paula Romo.",0,"El Comercio"
"El COE Nacional aprobó el 29 de julio del 2020 nuevas restricciones para frenar la propagación del covid-19 en 18 provincias. La prohibición de venta de bebidas alcohólicas durante el fin de semana y un nuevo horario de toque de queda los viernes, sábado y domingo regirán por 15 días.",0,"El Comercio"
"Desde las 00:00 de este viernes 31 de julio del 2020 rige la prohibición de la comercialización de bebidas alcohólicas. Esta medida estará acompañada de la ampliación del toque de queda, de 19:00 a 05:00. Las dos medidas estarán vigentes, de viernes a domingo, durante 15 días.",0,"El Comercio"
"Las empresas privadas y públicas, extranjeras o nacionales, podrán participar en igualdad de condiciones, en los procesos de otorgamiento de concesiones mineras. Esto será factible luego de que el 28 de julio pasado se publicara en el Registro Oficial las reformas a la Ley de Minería.",0,"El Comercio"
"Desde el 1 de junio del 2020 se mantiene vigente el protocolo al que deben sujetarse connacionales y extranjeros para su ingreso al Ecuador por la pandemia del covid-19. Sin embargo, hay casos en los que el viaje termina en enredos.",0,"El Comercio"
"Importadores, industrias y comercios que expenden licor ven con preocupación la decisión del COE nacional de imponer la prohibición de la venta de licor en 18 provincias de viernes a domingo (excepto restaurantes).",0,"El Comercio"
"Este jueves 30 de julio del 2020, el informe del Gobierno sobre la situación en Ecuador por el covid-19 registra 84 370 casos confirmados de la enfermedad, con un incremento de 1 177 respecto al reporte de ayer. La provincia de Pichincha concentra el 19,43% de casos del nuevo coronavirus, Guayas el 23,16% y Manabí el 8,58%.",0,"El Comercio"
"El Ministerio de Finanzas respondió mediante un comunicado a la demanda interpuesta por los fondos de inversión Contrarian Management y GMO, en contra del Gobierno de Ecuador, en el contexto de la renegociación de la deuda en bonos.",0,"El Comercio"
"Industriales e importadores de licor rechazaron este miércoles, 29 de julio del 2020, la decisión del COE Nacional de prohibir la venta de licor en 18 provincias.",0,"El Comercio"
"De las 19 piezas arqueológicas encontradas en el domicilio del expresidente Abdalá Bucaram, tres serían originales. Así lo confirmó a este Diario Joaquín Moscoso, Director del Instituto Nacional de Patrimonio Cultural, la tarde de este 29 de julio del 2020.",0,"El Comercio"
"""No se puede combatir un incendio con los ojos vendados. Y no <U+200E>podemos detener esta pandemia si no sabemos quién está <U+200E>infectado. Tenemos un mensaje muy sencillo para todos los países: pruebas, <U+200E>pruebas, pruebas.<U+200E>...”.",0,"El Comercio"
"La asambleísta del correísmo Amapola Naranjo solicitó este miércoles 29 de julio del 2020 al Consejo de Administración de la Legislatura (CAL) que se inicie un proceso de destitución para el independiente Eliseo Azuero, de quien se desconoce su paradero.",0,"El Comercio"
"Las oficinas de la Fiscalía en Quito se encuentran cerradas. La pandemia provocada por el covid-19 han impedido el restablecimiento de la atención al público.",0,"El Comercio"
"El Ministro de Salud, Juan Carlos Zeballos, anunció que Ecuador participaría en ensayos clínicos de la vacuna Covax para enfrentar la pandemia del coronavirus.",0,"El Comercio"
"Las firmas de inversiones Contrarian Capital Management LLC y GMO LLC presentaron este miércoles 29 de julio del 2020 un juicio en contra del Gobierno de Ecuador, con el que busca detener el proceso de renegociación de la deuda de USD 17 375 millones en bonos, que el Gobierno lleva a cabo desde el 3 de junio del 2020.",0,"El Comercio"
"914 nuevos casos de covid-19 registra Ecuador en las últimas 24 horas con lo que el total nacional llegó a 83 193 este miércoles 29 de julio del 2020, según el reporte N° 153 del Comité de Operaciones de Emergencia (COE) con corte a las 08:00.",0,"El Comercio"
"Las autoridades de Colombia entregaron a Ecuador a Claudia Orozco. El proceso de extradición de la ciudadana colombiana, que es investigada por narcotráfico, se cumplió la mañana del martes 28 de julio del 2020 en el Puente Internacional de Rumichaca.",0,"El Comercio"
"La superficie de un volcán no representa -en su totalidad- la diversidad de la composición de magma que habita en sus profundidades. El futuro de su actividad, en cambio, está marcadi por la evolución con el paso del tiempo. Esa fue de una de las conclusiones que arrojó un estudio realizado por un grupo de investigadores de Estados Unidos, Reino Unido y Ecuador. Los científicos establecieron que los volcanes Wolf y Fernandina de las islas Galápagos producen erupciones de lava basáltica que ‘esconden’ magmas con potencial de generar actividad explosiva.",0,"El Comercio"
"El Comité de Comercio Exterior (Comex) dispuso el archivo definitivo del proceso de investigación sobre la medida de salvaguardia a las importaciones de cerámica plana. El Gobierno evaluaba desde noviembre de 2019 este pedido de las empresas ecuatorianas Graiman, Rialto, Italpisos y Ecuatoriana de Cerámica.",0,"El Comercio"
"Los lineamientos para las nuevas modalidades de educación están listos. El viernes 24 de julio del 2020, la Cartera del ramo emitió un Acuerdo Ministerial y una reforma, que traen las reglas de funcionamiento de la modalidad abierta, que los colegios pudieran adoptar, de forma permanente, más allá de la emergencia sanitaria, provocada por el covid-19, si así lo solicitaran, a través de un trámite. La modalidad abierta incluye educación virtual y en línea y homeschooling o educación en casa.",0,"El Comercio"
"El presidente de la República, Lenín Moreno, ratificó a través del Decreto 1110 el Acuerdo Comercial entre Ecuador y Reino Unido e Irlanda del Norte. El documento fue emitido por el Ejecutivo el 27 de julio del 2020.",0,"El Comercio"
"La Agencia Metropolitana de Tránsito (AMT) reiteró que la Revisión Técnica Vehicular y la matriculación en Quito continúan suspendidas. Hizo esta aclaración mediante un comunicado la tarde de este martes 28 de julio del 2020.",0,"El Comercio"
"Ocho organizaciones sociales de Esmeraldas realizarán un plantón en los exteriores de la Refinería este miércoles 29 de julio a las 10:00, para mostrar su desacuerdo con la anunciada concesión del complejo industrial.",0,"El Comercio"
"Por medio de redes sociales, usuarios reportaron, este 28 de julio del 2020, problemas para acceder al servicio de internet de la operadora Netlife.",0,"El Comercio"
"Las limitaciones que rigen para viajar a propósito de la pandemia del covid-19 han incentivado a que las personas realicen sus compras en tiendas del exterior y las traigan a través de empresas que brindan el servicio de courier.",0,"El Comercio"
"El Ministerio de Finanzas respondió el 27 de julio del 2020 los informes de prensa sobre su invitación para reestructurar los bonos de deuda al portal especializado PCNewswire.",0,"El Comercio"
"Quito reportó 12 747 casos confirmados de covid-19 con pruebas PCR, en tanto que Ecuador alcanzó 82 279 contagios, según el informe Nro. 152 emitido por el Ministerio de Salud Publica de Ecuador con datos recabados hasta las 08:00 de este martes 28 de julio del 2020.",0,"El Comercio"
"La Asociación de Municipalidades del Ecuador (AME) informó que este miércoles 29 de julio del 2020 se iniciarán diálogos con el Gobierno Nacional.",0,"El Comercio"
"La tarde de este lunes, 27 de julio del 2020, acudió José Martínez, director del Sistema de pensiones del Instituto Ecuatoriano de Seguridad Social (IESS), a la Comisión del Derecho a la Salud.",0,"El Comercio"
"Este domingo 26 de julio del 2020, la ministra de Educación, Monserrat Creamer, escribió en su cuenta de Twitter: ""Aspecto importante al evaluar la necesidad de retorno progresivo a clases"". Y compartió un tuit de Unicef Ecuador. El Fondo de las Naciones Unidas para la Infancia escribió: ""Entre más tiempo permanezcan las escuelas cerradas, más se amplía el riesgo de que los niños y niñas en situaciones de vulnerabilidad no regresen a las escuelas"".",0,"El Comercio"
"En los hogares la llegada del fin de mes trae consigo el pago de deudas y otras obligaciones. Cubrir arriendos, tarjetas de crédito y hasta las compras de comida son un desafío para los hogares que han visto mermados sus ingresos por los efectos económicos de la pandemia.",0,"El Comercio"
"El avistamiento de ballenas jorobadas concita cada año el interés de unos 35 000 personas solo en el turístico cantón de Puerto López, en Manabí, el primero en abrir la temporada de avistamiento de ballenas 2020 en la costa, con protocolos de bioseguridad por la pandemia de covid-19.",0,"El Comercio"
"El Ministerio de Cultura y Patrimonio informó este lunes 27 de julio que el tigrillo, un plato tradicional de la gastronomía de Zaruma, en la provincia de El Oro, fue reconocido como parte del Patrimonio Cultural Inmaterial del Ecuador.",0,"El Comercio"
"Ecuador convocó para este miércoles 29 de julio a una reunión con Colombia, Perú y Chile, que forman parte de la Comisión del Pacífico Sur, en donde se analizará la presencia de buques pesqueros de varios países cerca de Galápagos.",0,"El Comercio"
"El coronavirus sigue expandiéndose en el territorio ecuatoriano de forma comunitaria, por lo que todavía no se puede hablar de un aplanamiento de la curva de contagio de la enfermedad, tras cinco meses de pandemia.",0,"El Comercio"
"Las autoridades del Hospital Claudio Benati de la parroquia Zumbahua en el cantón Pujilí, en Cotopaxi, recibieron implementos e insumos para que el personal médico atienda los casos de covid-19.",0,"El Comercio"
"El irrespeto a las disposiciones para frenar el covid-19 hizo que los grupos especiales de las FF.AA. lleguen a Quito y recorran las vías. Patrullan en grupos de hasta 20 soldados.",0,"El Comercio"
"Si bien todavía no existe una cura para el covid-19 en el mundo, el primer día de mayo, la Agencia para la Administración de Medicamentos de Estados Unidos (FDA) emitió una “autorización de uso urgente” del antiviral remdesivir para el tratamiento de casos graves de coronavirus. Y el 25 de junio, la Agencia Europea de Medicamentos (EMA) dio a la Comisión Europea una “autorización condicional”.",0,"El Comercio"
"Casi el 10% de 30 000 carnés de discapacidad fueron emitidos de manera fraudulenta por 22 funcionarios del Ministerio de Salud Pública (MSP) que enfrentan sumarios administrativos para su desvinculación, informó hoy, 27 de julio del 2020, el titular de esta Cartera, Juan Carlos Zevallos.",0,"El Comercio"
"De las diez empresas del país con mayores ingresos por ventas en el 2019, seis fueron de la provincia del Guayas, según el ranking empresarial del 2020, publicado por la Superintendencia de Compañías.",0,"El Comercio"
"El retorno de Dalo Bucaram al Ecuador es incierto. Así lo aseguró su abogado Jorge Acosta e indicó que eso será analizado por su cliente en su debido momento.",0,"El Comercio"
"Como parte de la conmemoración del 199 aniversario de la Independencia de Perú, la tarde de este 27 de julio del 2020, se presentará el estreno mundial de ‘El Retablo Sinfónico’, en versión de cámara.",0,"El Comercio"
"Ecuador registra este lunes 27 de julio del 2020 un total de 81 161 casos confirmados de covid-19 a escala nacional. 467 nuevos contagios en 24 horas, según el informe 151 del Ministerio de Salud Pública, con corte a las 08:00.",0,"El Comercio"
"La situación de refugios y organizaciones de rescate animal se ha complicado durante esta emergencia por el covid-19. El aumento de perros abandonados y la disminución de donaciones son algunos de los obstáculos que han tenido que enfrentar desde que empezó el aislamiento y que con el paso de los meses no ha mejorado. Algunas, como Lucky, incluso han anunciado su cierre.",0,"El Comercio"
"Durante una semana, entre el 27 y 31 de julio del 2020, los 592 notarios del Ecuador se capacitarán sobre el Sistema de Actos Notariales y Registrales (Sanyr), implementado por la Dirección Nacional de Registro de Datos Públicos (Dinardap). Esta actividad se desarrollará vía ‘online’ y como parte de la coordinación con el Consejo de la Judicatura.",0,"El Comercio"
"Un día como hoy, hace 24 años, Jefferson Leonardo Pérez Quezada hizo historia al ganar la medalla de oro en los 20 km marcha, en los Juegos Olímpicos de Atlanta 1996, y ser el primer ecuatoriano en subir al podio en una cita olímpica.",0,"El Comercio"
"Ecuador registró 80 036 casos confirmados de covid-19, después de aplicar 224 197 pruebas rápidas y PCR a la población, informó el Gobierno este sábado 25 de julio del 2020.",0,"El Comercio"
"Los rayos ultravioleta y la exposición prolongada al sol pueden afectar a la piel y pelaje de las mascotas. Ahora que el verano se inicia, es necesario tomar mayores precauciones para prevenir enfermedades dermatológicas o incluso cáncer a la piel.",0,"El Comercio"
"Martin McVuelo (Juan José Franco) y el Doc Brownie (Christoph Baumann) eligen el año 2020 para emprender una de sus nuevas aventuras a través del tiempo. Lo que no saben es que terminarán en Ecuador, en medio de una pandemia y en pleno toque de queda.",0,"El Comercio"
"A las 19:16 de este viernes, 24 de julio del 2020, la intendenta de Policía, Daniela Valarezo, informó en su cuenta de Twitter, que acababa de suspender una fiesta de graduación, que se desarrollaba en Calderón, extremo norte de Quito. En unas fotografías se observa carpas, para la recepción. ""El derecho de uno termina cuando comienza el de los demás. La salud está primero"", escribió y recordó que las reuniones están prohibidas. ""Cuidémonos del virus, protejamos a nuestra familia"".",0,"El Comercio"
